<!-- Root element for an individual test case, allows these to be wrapped into
XML lists -->
<testCase xmlns:xsi="http://www.w3.org/2001/XMLSchema-instance"
 xsi:noNamespaceSchemaLocation="testCase.xsd" testable="TRUE">
  <!-- Unique ID for the test case -->
  <id specification="E-ARK CSIP" version="2.2.0" requirementId="CSIPSTR11"/>
  <!-- URL references to requirements for convenient lookup -->
  <references>
    <reference requirementId="CSIPSTR11" URL="http://earkcsip.dilcis.eu/#CSIPSTR11" />
  </references>
  <requirementText> The representation folder SHOULD include a sub-folder named data which includes all data constituting the representation.
</requirementText>
  <!-- Textual description of the test case, may just be a repeat of the
  requirment text. -->
  <description>The representation folder SHOULD include a sub-folder named data which includes all data constituting the representation.
</description>
  <!-- List of requirments that this test case depends on in addition to the main requirememt, e.g. general requirments on the form of IDs -->
  <dependencies>
  </dependencies>
  <!-- A list of the validation rules derived from the test case -->
  <rules>
    <!-- Individual validation rule entry, identified by a running number that's unique within the test case only -->
    <!-- Rule for the existence of a dmdSec element in mets.xml -->

    <rule id="1">
      <!-- Text description of the validation rule -->
      <description>The representation folder SHOULD include a sub-folder named data </description>
      <!-- Details of the validation error generated by the message, can be one of: [ ERROR | WARNING | INFO ]-->
      <error level="WARNING">
        <!-- Expected error message when the rule is violated. -->
        <message>The representation folder does not include a sub-folder named `data`. It SHOULD include a sub-folder named data  </message>
      </error>
      <corpusPackages>
        <!-- Details of corpus packages designed to test this validation rule. -->
        <package name="IP_18000_CSIPSTR11_1" isValid="FALSE" isImplemented="TRUE">
          <path>valid/CSIPSTR11_1</path>
          <!-- Full description of corpus package features. -->
          <description>A package based on the folder stucture IP. Sub-folder 'data' named in camelcase</description>
        </package>
        <package name="IP_18000_CSIPSTR11_2" isValid="FALSE" isImplemented="TRUE">
          <path>valid/CSIPSTR11_2</path>
          <!-- Full description of corpus package features. -->
          <description>A package based on the folder stucture IP. Sub-folder 'data' has extra lowercase character in back</description>
        </package>
        <package name="IP_18000_CSIPSTR11_3" isValid="FALSE" isImplemented="TRUE">
          <path>valid/CSIPSTR11_3</path>
          <!-- Full description of corpus package features. -->
          <description>A package based on the folder stucture IP.  Sub-folder 'data' has extra lowercase character in front</description>
        </package>
        <package name="IP_18000_CSIPSTR11_4" isValid="FALSE" isImplemented="TRUE">
          <path>valid/CSIPSTR11_4</path>
          <!-- Full description of corpus package features. -->
          <description>A package based on the folder stucture IP. Sub-folder 'data'  has extra lowercase character in the middle. </description>
        </package>
        <package name="IP_18000_CSIPSTR11_5" isValid="FALSE" isImplemented="TRUE">
          <path>valid/CSIPSTR11_5</path>
          <!-- Full description of corpus package features. -->
          <description>A package based on the folder stucture IP. Sub-folder 'data' has extra uppercase character in back</description>
        </package>
        <package name="IP_18000_CSIPSTR11_6" isValid="FALSE" isImplemented="TRUE">
          <path>valid/CSIPSTR11_6</path>
          <!-- Full description of corpus package features. -->
          <description>A package based on the folder stucture IP.Sub-folder 'data' has extra uppercase character in front</description>
        </package>
        <package name="IP_18000_CSIPSTR11_7" isValid="FALSE" isImplemented="TRUE">
          <path>valid/CSIPSTR11_7</path>
          <!-- Full description of corpus package features. -->
          <description>A package based on the folder stucture IP.Sub-folder 'data' has extra uppercase character in middle</description>
        </package>
        <package name="IP_18000_CSIPSTR11_8" isValid="FALSE" isImplemented="TRUE">
          <path>valid/CSIPSTR11_8</path>
          <!-- Full description of corpus package features. -->
          <description>A package based on the folder stucture IP. Sub-folder 'data'  missing in root folder</description>
        </package>
        <package name="IP_18000_CSIPSTR11_9" isValid="FALSE" isImplemented="TRUE">
          <path>valid/CSIPSTR11_9</path>
          <!-- Full description of corpus package features. -->
        <description>A package based on the folder stucture IP. Sub-folder 'data' has extra number sign in back </description>
        </package>
        <package name="IP_18000_CSIPSTR11_10" isValid="FALSE" isImplemented="TRUE">
          <path>valid/CSIPSTR11_10</path>
          <!-- Full description of corpus package features. -->
          <description>A package based on the folder stucture IP. Sub-folder 'data' has extra number sign in front. </description>
        </package>
        <package name="IP_18000_CSIPSTR11_11" isValid="FALSE" isImplemented="TRUE">
          <path>valid/CSIPSTR11_11</path>
          <!-- Full description of corpus package features. -->
          <description>A package based on the folder stucture IP. Sub-folder 'data' has extra number sign in middle. </description>
        </package>
        <package name="IP_18000_CSIPSTR11_12" isValid="FALSE" isImplemented="TRUE">
          <path>valid/CSIPSTR11_12</path>
          <!-- Full description of corpus package features. -->
          <description>A package based on the folder stucture IP. Sub-folder 'data' has extra sign in back. </description>
        </package>
        <package name="IP_18000_CSIPSTR11_13" isValid="FALSE" isImplemented="TRUE">
          <path>valid/CSIPSTR11_13</path>
          <!-- Full description of corpus package features. -->
          <description>A package based on the folder stucture IP. Sub-folder 'data' has extra sign in middle.</description>
        </package>
        <package name="IP_18000_CSIPSTR11_14" isValid="FALSE" isImplemented="TRUE">
          <path>valid/CSIPSTR11_14</path>
          <!-- Full description of corpus package features. -->
          <description>A package based on the folder stucture IP. Sub-folder 'data' has extra sign in front.</description>
        </package>
        <package name="IP_18000_CSIPSTR11_15" isValid="FALSE" isImplemented="TRUE">
          <path>valid/CSIPSTR11_15</path>
          <!-- Full description of corpus package features. -->
          <description>A package based on the folder stucture IP. Sub-folder 'data' named in uppercase. </description>
        </package>
      </corpusPackages>
    </rule>
  </rules>
</testCase>
