<!-- Root element for an individual test case, allows these to be wrapped into
XML lists -->
<testCase xmlns:xsi="http://www.w3.org/2001/XMLSchema-instance" xsi:noNamespaceSchemaLocation="testCase.xsd"
  testable="TRUE">
  <!-- Unique ID for the test case -->
  <id specification="E-ARK CSIP" version="2.0-DRAFT" requirementId="CSIPSTR8"/>
  <!-- URL references to requirements for convenient lookup -->
  <references>
    <reference requirementId="CSIPSTR8" URL="http://earkcsip.dilcis.eu/#CSIPSTR8"/>
  </references>
  <!-- The full text of the requirement. -->
  <requirementText>  If any other metadata are available, they CAN be included in separate sub-folders, for example an additional folder named other.
  </requirementText>
  <!-- Textual description of the test case, extra notes beyond the requirment text. -->
  <description></description>
  <!-- List of requirments that this test case depends on in addition to the
  main requirememt, e.g. general requirments on the form of IDs -->
  <dependencies>
  </dependencies>
  <!-- A list of the validation rules derived from the test case -->
  <rules>
  </rules>
</testCase>