<testCase xmlns:xsi="http://www.w3.org/2001/XMLSchema-instance" xsi:noNamespaceSchemaLocation="testCase.xsd" testable="TRUE">
  <id specification="CSIP" version="2.1.0" requirementId="CSIP10"/>
  <references>
    <reference requirementId="CSIP10" URL="http://earkcsip.dilcis.eu/#CSIP10"/>
  </references>
  <requirementText>
    <name>Agent</name>
    <location>mets/metsHdr/agent</location>
    <description>
      A mandatory agent element records the software used to create the package. Other uses of agents may be described in any local implementations that extend the profile.
    </description>
    <cardinality>1..n</cardinality>
    <level>MUST</level>
  </requirementText>
  <description>
    mets/metsHdr/agent MUST exist one or more times.
  </description>
  <dependencies />
  <rules>
    <rule id="1">
      <description>mets/metsHdr/agent MUST exist one or more times.</description>
      <error level="ERROR">
        <message>
          mets/metsHdr/agent element does not exist. MUST be: element exists one or more times.
        </message>
      </error>
      <corpusPackages>
        <package name="mets-xml_metsHdr_agent_not_exist" isValid="FALSE" isImplemented="TRUE">
          <path>invalid/mets-xml_metsHdr_agent_not_exist</path>
          <description>
            METS.xml file has no mets/metsHdr/agent element.
          </description>
        </package>
        <package name="minimal_IP_with_1_representation" isValid="TRUE" isImplemented="TRUE">
          <path>valid/minimal_IP_with_1_representation</path>
          <description>
            Minimal IP that matches all MUST requirements.
          </description>
        </package>
        <package name="minimal_IP_metsHdr_agent_2_instances" isValid="TRUE" isImplemented="TRUE">
          <path>valid/minimal_IP_metsHdr_agent_2_instances</path>
          <description>
            Minimal IP that matches all MUST requirements, and has two instances of mets/metsHdr/agent element.
          </description>
        </package>
      </corpusPackages>
    </rule>
  </rules>
</testCase>
