<testCase xmlns:xsi="http://www.w3.org/2001/XMLSchema-instance"
 xsi:noNamespaceSchemaLocation="testCase.xsd" testable="TRUE">
  <!-- Unique ID for the test case -->
  <id specification="E-ARK CSIP" version="2.0-DRAFT" requirementId="CSIPSTR13"/>
  <!-- URL references to requirements for convenient lookup -->
  <references>
    <reference requirementId="CSIPSTR13" URL="http://earkcsip.dilcis.eu/#CSIPSTR13" />
  </references>
  <requirementText> The representation folder SHOULD include a sub-folder named metadata which CAN include all metadata about the specific representation.
</requirementText>
  <!-- Textual description of the test case, may just be a repeat of the
  requirment text. -->
  <description>The representation folder SHOULD include a sub-folder named metadata which CAN include all metadata about the specific representation.
</description>
  <!-- List of requirments that this test case depends on in addition to the main requirememt, e.g. general requirments on the form of IDs -->
  <dependencies>
  </dependencies>
  <!-- A list of the validation rules derived from the test case -->
  <rules>
    <!-- Individual validation rule entry, identified by a running number that's unique within the test case only -->
    <!-- Rule for the existence of a dmdSec element in mets.xml -->
    <rule id="1">
      <!-- Text description of the validation rule -->
      <description>The representation folder SHOULD include a sub-folder named 'metadata' </description>
      <!-- Details of the validation error generated by the message, can be one of: [ ERROR | WARNING | INFO ]-->
      <error level="WARNING">
        <!-- Expected error message when the rule is violated. -->
        <message>The representation folder does not include a sub-folder named `metadata`. It SHOULD include a sub-folder named 'metadata'  </message>
      </error>
      <corpusPackages>
        <!-- Details of corpus packages designed to test this validation rule. -->
        <package name="IP_18000_CSIPSTR13_1" isValid="FALSE" isImplemented="FALSE">
          <path>/corpus/structure/CSIPSTR13/IP_18000_CSIPSTR13_1</path>
          <!-- Full description of corpus package features. -->
          <description>A package based on the folder stucture IP. sub-folder named 'metadata' named in camelcase</description>
        </package>
        <package name="IP_18000_CSIPSTR13_2" isValid="FALSE" isImplemented="FALSE">
          <path>/corpus/structure/CSIPSTR13/IP_18000_CSIPSTR13_2</path>
          <!-- Full description of corpus package features. -->
          <description>A package based on the folder stucture IP. sub-folder named 'metadata' has extra lowercase character in back</description>
        </package>
        <package name="IP_18000_CSIPSTR13_3" isValid="FALSE" isImplemented="FALSE">
          <path>/corpus/structure/CSIPSTR13/IP_18000_CSIPSTR13_3</path>
          <!-- Full description of corpus package features. -->
          <description>A package based on the folder stucture IP.  sub-folder named 'metadata' has extra lowercase character in front</description>
        </package>
        <package name="IP_18000_CSIPSTR13_4" isValid="FALSE" isImplemented="FALSE">
          <path>/corpus/structure/CSIPSTR13/IP_18000_CSIPSTR13_4</path>
          <!-- Full description of corpus package features. -->
          <description>A package based on the folder stucture IP. sub-folder named 'metadata'  has extra lowercase character in the middle. </description>
        </package>
        <package name="IP_18000_CSIPSTR13_5" isValid="FALSE" isImplemented="FALSE">
          <path>/corpus/structure/CSIPSTR13/IP_18000_CSIPSTR13_5</path>
          <!-- Full description of corpus package features. -->
          <description>A package based on the folder stucture IP. sub-folder named 'metadata' has extra uppercase character in back</description>
        </package>
        <package name="IP_18000_CSIPSTR13_6" isValid="FALSE" isImplemented="FALSE">
          <path>/corpus/structure/CSIPSTR13/IP_18000_CSIPSTR13_6</path>
          <!-- Full description of corpus package features. -->
          <description>A package based on the folder stucture IP.sub-folder named 'metadata' has extra uppercase character in front</description>
        </package>
        <package name="IP_18000_CSIPSTR13_7" isValid="FALSE" isImplemented="FALSE">
          <path>/corpus/structure/CSIPSTR13/IP_18000_CSIPSTR13_7</path>
          <!-- Full description of corpus package features. -->
          <description>A package based on the folder stucture IP.sub-folder named 'metadata' has extra uppercase character in middle</description>
        </package>
        <package name="IP_18000_CSIPSTR13_8" isValid="FALSE" isImplemented="FALSE">
          <path>/corpus/structure/CSIPSTR13/IP_18000_CSIPSTR13_8</path>
          <!-- Full description of corpus package features. -->
          <description>A package based on the folder stucture IP. sub-folder named 'metadata'  missing in root folder</description>
        </package>
        <package name="IP_18000_CSIPSTR13_9" isValid="FALSE" isImplemented="FALSE">
          <path>/corpus/structure/CSIPSTR13/IP_18000_CSIPSTR13_9</path>
          <!-- Full description of corpus package features. -->
        <description>A package based on the folder stucture IP. sub-folder named 'metadata' has extra number sign in back </description>
        </package>
        <package name="IP_18000_CSIPSTR13_10" isValid="FALSE" isImplemented="FALSE">
          <path>/corpus/structure/CSIPSTR13/IP_18000_CSIPSTR13_10</path>
          <!-- Full description of corpus package features. -->
          <description>A package based on the folder stucture IP. sub-folder named 'metadata' has extra number sign in front. </description>
        </package>
        <package name="IP_18000_CSIPSTR13_11" isValid="FALSE" isImplemented="FALSE">
          <path>/corpus/structure/CSIPSTR13/IP_18000_CSIPSTR13_11</path>
          <!-- Full description of corpus package features. -->
          <description>A package based on the folder stucture IP. sub-folder named 'metadata' has extra number sign in middle. </description>
        </package>
        <package name="IP_18000_CSIPSTR13_12" isValid="FALSE" isImplemented="FALSE">
          <path>/corpus/structure/CSIPSTR13/IP_18000_CSIPSTR13_12</path>
          <!-- Full description of corpus package features. -->
          <description>A package based on the folder stucture IP. sub-folder named 'metadata' has extra sign in back. </description>
        </package>
        <package name="IP_18000_CSIPSTR13_13" isValid="FALSE" isImplemented="FALSE">
          <path>/corpus/structure/CSIPSTR13/IP_18000_CSIPSTR13_13</path>
          <!-- Full description of corpus package features. -->
          <description>A package based on the folder stucture IP. sub-folder named 'metadata' has extra sign in middle.</description>
        </package>
        <package name="IP_18000_CSIPSTR13_14" isValid="FALSE" isImplemented="FALSE">
          <path>/corpus/structure/CSIPSTR13/IP_18000_CSIPSTR13_14</path>
          <!-- Full description of corpus package features. -->
          <description>A package based on the folder stucture IP. sub-folder named 'metadata' has extra sign in front.</description>
        </package>
        <package name="IP_18000_CSIPSTR13_15" isValid="FALSE" isImplemented="FALSE">
          <path>/corpus/structure/CSIPSTR13/IP_18000_CSIPSTR13_15</path>
          <!-- Full description of corpus package features. -->
          <description>A package based on the folder stucture IP. sub-folder named 'metadata' named in uppercase. </description>
        </package>
      </corpusPackages>
    </rule>
    <rule id = "2">
      <description>Sub-folder named metadata CAN include all metadata about the specific representation. </description>
      <!-- Details of the validation error generated by the message, can be one of: [ ERROR | WARNING | INFO ]-->
      <error level="INFO">
        <!-- Expected error message when the rule is violated. -->
        <message>Sub-folder named 'metadata' contains following files:   </message>
      </error>
      <corpusPackages>
      <package name="IP_18000_CSIPSTR13_16" isValid="TRUE" isImplemented="FALSE">
        <path>/corpus/structure/CSIPSTR13/IP_18000_CSIPSTR13_16</path>
        <!-- Full description of corpus package features. -->
        <description>A package based on the folder stucture IP. Sub-folder named 'metadata' is empty</description>
      </package>
    </corpusPackages>
    </rule>
  </rules>
</testCase>
