<?xml version="1.0" encoding="UTF-8"?>
<!-- Root element for an individual test case, allows these to be wrapped into
XML lists -->
<testCase xmlns:xsi="http://www.w3.org/2001/XMLSchema-instance" xsi:noNamespaceSchemaLocation="testCase.xsd"
  testable="TRUE">
  <!-- Unique ID for the test case -->
  <id specification="E-ARK CSIP" version="2.2.0" requirementId="CSIP116"/>
  <!-- URL references to requirements for convenient lookup -->
  <references>
    <reference requirementId="CSIP116" URL="http://earkcsip.dilcis.eu/#CSIP116"/>
  </references>
  <!-- The full text of the requirement. -->
  <requirementText>	Documentation file group reference pointer
    mets/structMap[@LABEL='CSIP']/div/div[@LABEL='Documentation']/fptr/@FILEID
    A reference, by ID, to the “Documentation” file group.
    Related to the requirements CSIP60 which describes the “Documentation” file group and CSIP65 which describes the file group identifier.
  </requirementText>
  <!-- Textual description of the test case, extra notes beyond the requirment text. -->
  <description> All fileGrps with the @USE="Documentation" must also be presented in the structMap. CSIP96 and CSIP116 are intrinsically linked together and therefore is the same testcase.
  </description>
  <!-- List of requirments that this test case depends on in addition to the
  main requirememt, e.g. general requirments on the form of IDs -->
  <dependencies>
    <dependency requirementId="CSIP96" URL="http://earkcsip.dilcis.eu/#CSIP96"></dependency>
  </dependencies>
  <!-- A list of the validation rules derived from the test case -->
  <rules>
    <rule id="1">
      <description>A structMap[@LABEL='CSIP']/div/div[@LABEL='Documentation']/fptr must point to a fileGrp with @USE="Documentation"</description>
      <error level="ERROR">
        <message>The structMap[@LABEL='CSIP']/div/div[@LABEL='Documentation']/fptr points to a fileGrp that does not have @USE="Documentation"</message>
      </error>
      <corpusPackages>
        <package isValid="FALSE" isImplemented="TRUE" name="structMap_does_not_point_at_documentation">
          <path>invalid/structMap_does_not_point_at_documentation</path>
          <description>A package which has a documentation filepointer that points to a filegroup that does not have @USE="Documentation"</description>
        </package>
        <package isValid="TRUE" isImplemented="TRUE" name="minimal_IP_with_1_representation">
          <path>valid/minimal_IP_with_1_representation</path>
          <description>Minimal IP</description>
        </package>
      </corpusPackages>
    </rule>
  </rules>
</testCase>
