<!-- Root element for an individual test case, allows these to be wrapped into
XML lists -->
<testCase xmlns:xsi="http://www.w3.org/2001/XMLSchema-instance" xsi:noNamespaceSchemaLocation="testCase.xsd"
  testable="TRUE">
  <!-- Unique ID for the test case -->
  <id specification="E-ARK CSIP" version="2.1.0" requirementId="CSIP24"/>
  <!-- URL references to requirements for convenient lookup -->
  <references>
    <reference requirementId="CSIP24" URL="http://earkcsip.dilcis.eu/#CSIP24"/>
  </references>
  <!-- The full text of the requirement. -->
  <requirementText>dmdSec/mdRef/@xlink:href. The actual location of the resource. This specification recommends recording a URL type filepath within this attribute.</requirementText>
  <!-- Textual description of the test case, extra notes beyond the requirment text. -->
  <description>dmdSec/mdRef/@xlink:href </description>
  <!-- List of requirments that this test case depends on in addition to the
  main requirememt, e.g. general requirments on the form of IDs -->
  <dependencies>
  </dependencies>
  <!-- A list of the validation rules derived from the test case -->
  <rules>
    <rule id="1">
      <description>@xlink:href must exist in METS.xml</description>
      <error level="ERROR">
        <message>There is no dmdSec/mdRef/@xlink:href in METS.xml. In METS.XML the dmdSec/mdRef-element MUST have the attribute: @xlink:href and its value must be a URL type filepath. </message>
      </error>
      <corpusPackages>
        <package isValid="FALSE" name="IP_18000_CSIP24_1" isImplemented="TRUE">
          <path>invalid/IP_18000_CSIP24_1</path>
          <description>There is no @xlink:href in METS.xml</description>
        </package>
      </corpusPackages>
    </rule>
    <rule id="2">
      <description>It is recommended to have a URL type filepath value in @xlink:href</description>
      <error level="WARNING">
        <message>In METS.XML the value in dmdSec/mdRef/@xlink:href SHOULD be a URL type filepath. The current value is not a URL type filepath </message>
      </error>
      <corpusPackages>
        <package isValid="FALSE" name="IP_18000_CSIP24_2" isImplemented="TRUE">
          <path>valid/IP_18000_CSIP24_2</path>
          <description>There is no value in dmdSec/mdRef/@xlink:href</description>
        </package>
      </corpusPackages>
    </rule>
  </rules>
</testCase>
