<testCase xmlns:xsi="http://www.w3.org/2001/XMLSchema-instance" xsi:noNamespaceSchemaLocation="testCase.xsd" testable="TRUE">
  <id specification="CSIP" version="2.0.4" requirementId="CSIP64"/>
  <references>
    <reference requirementId="CSIP64" URL="http://earkcsip.dilcis.eu/#CSIP64"/>
  </references>
  <requirementText>
    <name>Description of the use of the file group</name>
    <location>mets/fileSec/fileGrp/@USE</location>
    <description>
      The value in the mets/fileSec/fileGrp/@USE is the name of the whole folder structure to the data, e.g "Documentation", "Schemas", "Representations/preingest" or "Representations/submission/data".
    </description>
    <cardinality>1..1</cardinality>
    <level>MUST</level>
  </requirementText>
  <!--  Assumptions:
        - VocabularyFileGrpAndStructMapDivisionLabel is mandatory, despite it
          not being mentioned in the requirement text. This follows from the
          definitions of CSIP60, 113 and 114.
        - The match between fileGrp/@USE and folder path must be case insensitive
          because VocabularyFileGrpAndStructMapDivisionLabel mandates values
          with capital first letter but CSIPSTR5 - 16 mandate lowercase folder
          names.
  -->
  <description>
    For each mets/fileSec/fileGrp that exists, mets/fileSec/fileGrp/@USE MUST exist.
    mets/fileSec/fileGrp/@USE value MUST begin with or equal to a value from VocabularyFileGrpAndStructMapDivisionLabel.
    mets/fileSec/fileGrp/@USE value MUST match an existing folder path in the package, case insensitive.
  </description>
  <dependencies>
    <dependency requirementId="VocabularyFileGrpAndStructMapDivisionLabel" URL="https://earkcsip.dilcis.eu/#VocabularyFileGrpAndStructMapDivisionLabel">
      https://earkcsip.dilcis.eu/schema/CSIPVocabularyFileGrpAndStructMapDivisionLabel.xml
    </dependency>
  </dependencies>
  <rules>
    <rule id="1">
      <description>For each mets/fileSec/fileGrp that exists, mets/fileSec/fileGrp/@USE MUST exist.</description>
      <error level="ERROR">
        <message>
          mets/fileSec/fileGrp/@USE attribute does not exist. MUST be: For each mets/fileSec/fileGrp that exists, mets/fileSec/fileGrp/@USE MUST exist.
        </message>
      </error>
      <corpusPackages>
        <package name="fileGrp_USE_not_exist" isValid="FALSE" isImplemented="TRUE">
          <path>invalid/fileGrp_USE_not_exist</path>
          <description>
            METS.xml file has a mets/fileSec/fileGrp with no mets/fileSec/fileGrp/@USE attribute.
          </description>
        </package>
        <package name="minimal_IP_with_1_representation" isValid="TRUE" isImplemented="TRUE">
          <path>valid/minimal_IP_with_1_representation</path>
          <description>
            Minimal IP that matches all MUST requirements, plus all SHOULD requirements (both for elements and attributes), incl.:
            - the folder "documentation" exists (CSIPSTR16)
            - a fileGrp exists that has mets/fileSec/fileGrp/@USE = "Documentation".
          </description>
        </package>
      </corpusPackages>
    </rule>
    <rule id="2">
      <description>mets/fileSec/fileGrp/@USE value MUST begin with or equal to a value from VocabularyFileGrpAndStructMapDivisionLabel.</description>
      <error level="ERROR">
        <message>
          mets/fileSec/fileGrp/@USE attribute has incorrect value. MUST be: mets/fileSec/fileGrp/@USE value MUST begin with or equal to a value from VocabularyFileGrpAndStructMapDivisionLabel.
        </message>
      </error>
      <corpusPackages>
        <package name="fileGrp_USE_vocabulary_mismatch" isValid="FALSE" isImplemented="TRUE">
          <path>invalid/fileGrp_USE_vocabulary_mismatch</path>
          <description>
            METS.xml file has mets/fileSec/fileGrp/@USE = "random_string_e2368caa08a1cbbe2e8d5b96ab34a41e".
          </description>
        </package>
        <!--  Ideally, there should be a valid IP for each specific vocabulary
              value, as this is the only certain way to test that the validator
              accepts any one of them. This should be automated as
              VocabularyFileGrpAndStructMapDivisionLabel currently allows 4
              different values. -->
        <package name="minimal_IP_with_1_representation" isValid="TRUE" isImplemented="TRUE">
          <path>valid/minimal_IP_with_1_representation</path>
          <description>
            Minimal IP that matches all MUST requirements, plus all SHOULD requirements (both for elements and attributes), incl.:
            - the folder "documentation" exists (CSIPSTR16)
            - a fileGrp exists that has mets/fileSec/fileGrp/@USE = "Documentation"
            - mets/fileSec/fileGrp/@USE is properly declared for all fileGrp elements.
          </description>
        </package>
      </corpusPackages>
    </rule>
    <rule id="3">
      <description>mets/fileSec/fileGrp/@USE value MUST match an existing folder path in the package, case insensitive.</description>
      <error level="ERROR">
        <message>
          mets/fileSec/fileGrp/@USE attribute has incorrect value. MUST be: mets/fileSec/fileGrp/@USE value MUST match an existing folder path in the package, case insensitive.
        </message>
      </error>
      <corpusPackages>
        <package name="fileGrp_USE_folder_mismatch" isValid="FALSE" isImplemented="TRUE">
          <path>invalid/fileGrp_USE_folder_mismatch</path>
          <description>
            METS.xml file where:
            - mets/fileSec/fileGrp/@USE = "Representations/random_string_96ab34a41e".
            - no folder exists with the name "Representations/random_string_96ab34a41e".
            Note: the value "Representations/random_string_96ab34a41e" violates
            only the folder path match, but is OK for vocabulary match (i.e.
            begins with a value from the vocabulary).
          </description>
        </package>
        <package name="minimal_IP_with_1_representation" isValid="TRUE" isImplemented="TRUE">
          <path>valid/minimal_IP_with_1_representation</path>
          <description>
            Minimal IP that matches all MUST requirements, plus all SHOULD requirements (both for elements and attributes), incl.:
            - the folder "documentation" exists (CSIPSTR16)
            - a fileGrp exists that has mets/fileSec/fileGrp/@USE = "Documentation"
            - mets/fileSec/fileGrp/@USE is properly declared for all fileGrp elements.
          </description>
        </package>
      </corpusPackages>
    </rule>
  </rules>
</testCase>
