<testCase xmlns:xsi="http://www.w3.org/2001/XMLSchema-instance" xsi:noNamespaceSchemaLocation="testCase.xsd"
  testable="FALSE">
    <id specification="E-ARK CSIP" version="2.0.4" requirementId="CSIP103"/>
    <references>
    <reference requirementId="CSIP103" URL="https://earkcsip.dilcis.eu/#CSIP103"/>
  </references>
  <requirementText>
    <name>Content division label</name>
    <location>mets/structMap[@LABEL='CSIP']/div/div[@LABEL='Representations']</location>
    <description>
      The package's content division div element must have the @LABEL attribute value "Representations", taken from the vocabulary.
      See also: File group names
    </description>
    <cardinality>1..1</cardinality>
    <level>MUST</level>
  </requirementText>
  <description>
    CSIP103 seems identical to CSIP101, but the authors of the
    specification had a distinction in mind: "â€¦ the first requirement
    defines whether the division itself is mandatory, the second defines
    the required label value," see the issue "Redundancies and
    incompatible priority levels" at
    https://github.com/DILCISBoard/E-ARK-CSIP/issues/570. The cases of
    there being no 'Representations' division or more than one
    'Representations' division are handled in CSIP101. Consequently, there
    is only one rule left for CSIP103:
      If the 'Representations' division exists, it MUST have @LABEL='Representations'.

    This, however, is not reliably testable with algorithms of reasonable
    complexity. Detecting a representations division that is not marked
    @LABEL='Representations' would require analysing indirect indicators (e.g. a
    structMap/div with references to files in the /representations folder), but
    these cannot give enough confidence to announce a violation of a MUST
    rule.

    In sum, only valid IPs are meaningful for CSIP103 and the requirement is
    effectively not testable.
  </description>
  <dependencies>
    <dependency requirementId="CSIP101" URL="https://earkcsip.dilcis.eu/#CSIP101"></dependency>
  </dependencies>
  <rules>
    <rule id="1">
      <description>If the schema division exists, it MUST have @LABEL='Representations'.</description>
      <error level="ERROR">
        <message>If the schema division exists, it MUST have @LABEL='Representations'.</message>
      </error>
      <corpusPackages>
        <package isValid="TRUE" isImplemented="FALSE" name="minimal_IP_with_no_representations">
          <path>valid/minimal_IP_with_no_representations</path>
          <description>Minimal IP that has no representations, only metadata.</description>
        </package>
      </corpusPackages>
    </rule>
  </rules>
</testCase>
